{
  "schema_version": "1.0",
  "experiment_id": "9-9",
  "status": "blocked",
  "upstream": {
    "repository": "https://github.com/Vector-Wangel/XLeRobot.git",
    "commit": "3d14695e40c9c68229c0aacffca6053c75cd3eb6",
    "guide_path": "docs/en/source/software/getting_started/LLM_agent.md",
    "guide_blob": "d336a9e35838267614d31cdb98b9b50d66427f03",
    "robocrew_version": "0.3.1"
  },
  "run": {
    "started_at": null,
    "ended_at": null,
    "operator": null,
    "host": "documentation-only-host",
    "actuation_authorized": false,
    "receipt_path": null,
    "receipt_sha256": null
  },
  "safety": {
    "robot_calibrated": false,
    "clear_route": false,
    "emergency_stop_ready": false,
    "human_observer_present": false
  },
  "planner": {
    "provider": "google_genai",
    "model": "gemini-robotics-er-1.5-preview",
    "api_call_succeeded": false,
    "robocrew": false,
    "angular_overlay": false,
    "camera_fov_degrees": 90,
    "decision_frequency_hz": null,
    "tools": ["move_forward", "turn_left", "turn_right"]
  },
  "navigation": {
    "task": "find the kitchen and go there",
    "executed": false,
    "success": null,
    "semantic_cues": [],
    "steps": []
  },
  "voice_extension": {
    "executed": false,
    "wake_word": null
  },
  "artifacts": [],
  "blockers": [
    "No authorized XLeRobot navigation run or Gemini Robotics-ER API call was available; no motion was attempted."
  ]
}
